,news,date
0,The company says it has determined the likely cause of an explosion in September that led to setbacks in its schedule.,2017-01-02T14:30:09+0000
1,"The return to business for Elon Musk’s company was successful, despite being overshadowed by questions about the viability of his long-range plans.",2017-01-14T17:58:44+0000
2,"The highway agency found that while Tesla’s Autopilot feature didn’t prevent a crash in Florida, the system performed as it was intended.",2017-01-20T01:34:40+0000
3,Electric vehicles offer a new chance to Chinese car-making efforts that have floundered in the past. But lavish state aid could be as much bane as boon.,2017-01-26T16:43:52+0000
4,"The political tide might seem unfavorable for electric cars and solar panels, but the new president may see them as part of a job-producing future.",2017-01-26T17:39:58+0000
5,"The political tide might seem unfavorable for electric cars and solar panels, but the new president may see them as part of a job-producing future.",2017-01-26T17:39:58+0000
6,"Mr. Musk might seem to be anathema to the president, yet he’s part of Mr. Trump’s meetings with business leaders. The reasons: jobs, vision and power.",2017-01-27T16:55:18+0000
7,"Mr. Musk might seem to be anathema to the president, yet he’s part of Mr. Trump’s meetings with business leaders. The reasons: jobs, vision and power.",2017-01-27T16:55:18+0000
8,"Social media tries to tamp down fake news sites, the president isn’t giving up his unsecured phone and Elon Musk is trying to be a voice of reason.",2017-01-28T14:00:03+0000
9,A whirlwind three-month project is helping the luxury carmaker transform itself into a multifaceted clean energy company.,2017-01-30T14:00:25+0000
10,Whispered questions among business leaders over the weekend produced no clear consensus on what to say about the President Trump’s immigration order in public.,2017-01-31T02:07:42+0000
0,Uber’s chief executive told employees he was leaving a presidential advisory council after intense criticism from customers and employees.,2017-02-03T17:33:21+0000
1,"The tech industry was in an uproar over President Trump’s immigration order, but Silicon Valley’s most noted Trump supporter was unfazed. He’s applied for New Zealand citizenship.",2017-02-04T14:00:17+0000
2,"In a court filing, nearly 100 technology companies cited the “tremendous impact” of immigrants on the United States in opposing the Trump immigration ban.",2017-02-06T10:46:43+0000
3,"The popular imagination may associate billionaires with superyachts and private islands, but just as many live modestly, complicating the idea of the billionaire lifestyle.",2017-02-19T05:01:15+0000
4,The rocket lifted off from a launchpad used for the Apollo moon missions. It was the first launch from Kennedy Space Center in more than five years.,2017-02-19T14:53:33+0000
5,"A Falcon 9 rocket from Elon Musk’s Space Exploration Technologies Corporation, or SpaceX, was launched at the John F. Kennedy Space Center in Florida on Sunday, carrying supplies, experiments and cargo to the International Space Station.",2017-02-19T16:41:06+0000
6,No deal on the latest stage of a bailout is expected in Brussels. Minutes from the Federal Reserve’s first 2017 meeting could offer clues to its next move on interest rates.,2017-02-20T02:00:02+0000
7,"If the mission proceeds as planned, the private space travelers would be the first humans to venture that far into space in more than 40 years.",2017-02-27T23:59:32+0000
0,"Along with sensors, autonomous vehicles will need detailed maps of the road and the obstacles ahead. Creating these maps will be a monumental task.",2017-03-02T15:12:44+0000
1,Ready for liftoff?,2017-03-03T15:00:46+0000
2,"While the battle in Washington gets much of the attention, the most direct attack against electric vehicles is being waged in statehouses.",2017-03-11T10:00:18+0000
3,"While immigration, health care and Russia are hogging the media oxygen, big reversals are happening in Obama-era tech policy.",2017-03-11T14:00:03+0000
4,The electric carmaker has lost money three years in a row and plans to supercharge production of its mass market model with very little buffer.,2017-03-17T19:01:39+0000
5,The electric carmaker has lost money three years in a row and plans to supercharge production of its mass market model with very little buffer.,2017-03-17T19:01:39+0000
6,"The purchase came as the carmaker has sought to raise more cash before starting production of its Model 3, an electric vehicle targeting the mass market.",2017-03-28T14:24:56+0000
7,"The purchase came as the carmaker has sought to raise more cash before starting production of its Model 3, an electric vehicle targeting the mass market.",2017-03-28T14:24:56+0000
8,Ignoring climate change and the benefits of clean energy only helps a rival.,2017-03-29T07:21:26+0000
9,"The use of a rocket booster that had flown once before may open an era of cheaper space travel, particularly for business ventures like satellite companies.",2017-03-30T22:42:24+0000
10,"SpaceX launched a “pre-flown” rocket into space on Thursday. If the company can repeat it, this method could slash the price of space travel in the future.",2017-03-31T00:36:13+0000
0,"The electric-car maker said it produced 25,418 vehicles in the first quarter, compared with 15,510 a year ago. The company wants to produce 500,000 cars in 2018.",2017-04-03T00:20:32+0000
1,"The electric-car maker said it produced 25,418 vehicles in the first quarter, compared with 15,510 a year ago. The company wants to produce 500,000 cars in 2018.",2017-04-03T00:20:32+0000
2,"With signs that the long boom in American auto sales is tapering off, the Detroit giants are eclipsed on Wall Street by the electric-vehicle upstart.",2017-04-04T00:43:34+0000
3,"With signs that the long boom in American auto sales is tapering off, the Detroit giants are eclipsed on Wall Street by the electric-vehicle upstart.",2017-04-04T00:43:34+0000
4,The electric-car maker is the latest company to become a market darling based not on what it has achieved but on a vision of a dominant future.,2017-04-06T16:16:01+0000
5,The electric-car maker is the latest company to become a market darling based not on what it has achieved but on a vision of a dominant future.,2017-04-06T16:16:01+0000
6,"After passing Ford Motor a week ago, the electric car company edged past General Motors in early trading, with a market capitalization of $50.9 billion.",2017-04-10T14:51:02+0000
7,"After passing Ford Motor a week ago, the electric car company edged past General Motors in early trading, with a market capitalization of $50.9 billion.",2017-04-10T14:51:02+0000
8,"General Motors has achieved steady profits in a booming domestic market and has tried to prove its innovative approach, but investors are unimpressed.",2017-04-11T00:57:59+0000
9,"Tesla’s valuation implies that investors expect its chief executive, Elon Musk, to outdo even some of his biggest cheerleaders’ already rosy assumptions.",2017-04-11T18:58:56+0000
10,"Tesla’s valuation implies that investors expect its chief executive, Elon Musk, to outdo even some of his biggest cheerleaders’ already rosy assumptions.",2017-04-11T18:58:56+0000
11,"Investors have been energized by the electric-car maker’s upbeat outlook for delivering its mass-market model. Now its chief, Elon Musk, must deliver.",2017-04-12T01:01:25+0000
12,"Investors have been energized by the electric-car maker’s upbeat outlook for delivering its mass-market model. Now its chief, Elon Musk, must deliver.",2017-04-12T01:01:25+0000
0,"Investors have been bullish about the electric-car maker, but its ability to meet its goals is under scrutiny as it proceeds with a mass-market model.",2017-05-03T21:23:10+0000
1,"Investors have been bullish about the electric-car maker, but its ability to meet its goals is under scrutiny as it proceeds with a mass-market model.",2017-05-03T21:23:10+0000
0,Several large corporations quickly expressed dismay with President Trump’s decision and said they would continue their environmental efforts.,2017-06-01T22:02:42+0000
1,Several large corporations quickly expressed dismay with President Trump’s decision and said they would continue their environmental efforts.,2017-06-01T22:02:42+0000
2,The president’s decision to pull out of the Paris climate accord did not go over well with tech industry leaders.,2017-06-02T14:53:19+0000
3,The next SpaceX mission will carry insects and rodents to help scientists understand the effects of long-term life in space.,2017-06-02T16:27:15+0000
4,"General Motors beat back a bid to split its stock into two classes, and its upstart electric-car rival overcame a challenge to multiyear board terms.",2017-06-06T14:06:06+0000
5,"General Motors beat back a bid to split its stock into two classes, and its upstart electric-car rival overcame a challenge to multiyear board terms.",2017-06-06T14:06:06+0000
6,Researchers have proved a car can be remotely hacked. Now imagine if that car was being driven entirely by a computer.,2017-06-07T15:34:41+0000
7,The company said foreign production was needed to make its models more affordable overseas. Its plan for a plant would require a Chinese partner.,2017-06-22T18:51:08+0000
0,"As the electric-car maker moves to expand its lineup, it said problems with battery manufacturing had held down sales of existing models this year.",2017-07-03T06:55:24+0000
1,"As the electric-car maker moves to expand its lineup, it said problems with battery manufacturing had held down sales of existing models this year.",2017-07-03T06:55:24+0000
2,"The electric-car maker’s shares are off sharply after a report of production trouble, giving General Motors back its lead after less than three months.",2017-07-06T13:51:54+0000
3,"The electric-car maker’s shares are off sharply after a report of production trouble, giving General Motors back its lead after less than three months.",2017-07-06T13:51:54+0000
4,"Conversation starters and context, drawn from the day’s news in Australia.",2017-07-07T05:52:30+0000
5,"Under pressure from car dealers, the state is one of several that bars the electric-car maker from selling directly to the public.",2017-07-07T07:21:19+0000
6,"A growing number of analysts say pessimism about plug-in cars could be becoming outdated, thanks in part to plunging battery prices.",2017-07-08T04:07:40+0000
7,The technology is catching on faster than predicted.,2017-07-18T07:21:28+0000
8,The entrepreneur said on Twitter that he had verbal approval to build a transportation artery connecting cities from New York to Washington D.C.,2017-07-20T18:40:48+0000
9,"Elon Musk’s rocket company raised $350 million in new financing, raising its valuation to about $21 billion.",2017-07-27T20:20:08+0000
10,"Elon Musk, Tesla’s chief executive, delivered 30 cars to employees chosen to be the first owners. The electric-car maker faces a challenge in meeting the sizable demand.",2017-07-29T04:10:49+0000
11,"Elon Musk, Tesla’s chief executive, delivered 30 cars to employees chosen to be the first owners. The electric-car maker faces a challenge in meeting the sizable demand.",2017-07-29T04:10:49+0000
0,"The electric-car maker lost more than $400 million in the second quarter, but its revenue doubled, with its first mass-market model in the offing.",2017-08-02T21:15:01+0000
1,"The electric-car maker lost more than $400 million in the second quarter, but its revenue doubled, with its first mass-market model in the offing.",2017-08-02T21:15:01+0000
2,Diluting its shares by just 3 percent would have done the trick at less risk. But bondholders don’t need shareholders’ faith in Elon Musk to be paid back.,2017-08-07T18:53:15+0000
3,Diluting its shares by just 3 percent would have done the trick at less risk. But bondholders don’t need shareholders’ faith in Elon Musk to be paid back.,2017-08-07T18:53:15+0000
4,"Humans have historically tended to travel about half an hour to work, regardless of how fast the mode of transportation.",2017-08-10T09:30:19+0000
0,Three rules for ensuring that A.I. systems don’t run roughshod over humans.,2017-09-02T01:10:42+0000
1,"The company remotely enabled free software upgrades for Florida drivers during the hurricane, sparking questions about Tesla’s oversight.",2017-09-12T00:15:22+0000
2,"In a fatal accident last year, the National Transportation Safety Board said, the automaker allowed autonomous driving in unsuitable conditions.",2017-09-12T14:50:25+0000
3,"Mr. Musk’s booster, scaled back from last year’s plan but still the largest ever, could take travelers to Mars, the moon — or around the world in minutes.",2017-09-28T22:08:39+0000
0,"This week’s newsletter explores Australia’s sense of when to strictly abide by the rules, and when to ignore, bend or change them.",2017-10-05T03:09:19+0000
1,"Compared to a short pit stop at a gas station, charging an electric vehicle can be a time-consuming experience. But change is at hand.",2017-10-05T13:51:44+0000
2,"The dismissals came as the electric-car maker tries to increase the production of its first mass-market vehicle, the Model 3 sedan.",2017-10-14T03:38:39+0000
3,"Automated cars will save lives and make us more productive, manufacturers say. But most Americans say, not so fast.",2017-10-14T21:12:46+0000
4,Tesla is said to be moving closer to becoming the first foreign car company to have a wholly owned manufacturing operation in the country.,2017-10-23T01:11:11+0000
5,"By restricting the range of its cars for a reduced price, Tesla annoyed some critics, but it was engaging in a common and beneficial practice.",2017-10-27T15:22:37+0000
0,In which I try to wrap my mind around tax incidence yet again.,2017-11-01T17:29:29+0000
1,"The electric-car maker cited record output of its existing models, and its chief said bottlenecks on its first mass-market offering were being resolved.",2017-11-01T22:01:27+0000
2,"The electric-car maker cited record output of its existing models, and its chief said bottlenecks on its first mass-market offering were being resolved.",2017-11-01T22:01:27+0000
3,"The Republican proposal calls for abolishing a $7,500 credit for purchases of all-electric and plug-in hybrid vehicles, just as automakers are expanding lineups.",2017-11-02T22:26:36+0000
4,"Pieter Abbeel, a Berkeley professor, is part of the team that has started Embodied Intelligence to make it possible for robots to learn on their own.",2017-11-07T00:00:32+0000
5,"For Elon Musk’s company, autonomous driving is just a pit stop on the road to a better planet. Can it survive long enough to get there?",2017-11-07T07:03:40+0000
6,"For Elon Musk’s company, autonomous driving is just a pit stop on the road to a better planet. Can it survive long enough to get there?",2017-11-07T07:03:40+0000
7,"With fewer cultural hurdles and more financial incentives than car owners, big-rig operators are charting the route to an autonomous future.",2017-11-13T05:01:19+0000
8,"Aiming to remake a multibillion-dollar industry, the automaker said it would have a semi for sale in two years that would be nearly self-driving.",2017-11-17T04:29:44+0000
9,"Aiming to remake a multibillion-dollar industry, the automaker said it would have a semi for sale in two years that would be nearly self-driving.",2017-11-17T04:29:44+0000
10,"Space shuttle launches were Earth-rattling when seen in person. Now rocket launches can be covered through an iPhone, says Kenneth Chang, who covers space for The Times.",2017-11-22T15:36:13+0000
11,"South Australia had a blackout problem, and the Tesla founder had a solution: a battery the size of a football field.",2017-11-30T17:01:26+0000
12,"South Australia had a blackout problem, and the Tesla founder had a solution: a battery the size of a football field.",2017-11-30T17:01:26+0000
0,"The last year gave us some whopping deals, including Amazon.com’s acquisition of Whole Foods, that will shape the business landscape in 2018.",2018-01-02T01:18:04+0000
1,Production of the electric-car maker’s mass-market offering was far below forecasts in the fourth quarter. The report sent the company’s shares lower.,2018-01-04T01:45:24+0000
2,Production of the electric-car maker’s mass-market offering was far below forecasts in the fourth quarter. The report sent the company’s shares lower.,2018-01-04T01:45:24+0000
3,The manufacturers complain that they will soon be at a disadvantage — once they hit a sales mark that leaves their buyers without the benefit of a tax credit.,2018-01-11T20:46:34+0000
4,SpaceX launched its Falcon Heavy rocket for the second time on Thursday.,2018-01-22T18:25:40+0000
5,"After years of delay, the Falcon Heavy — a beefed-up version of SpaceX’s workhorse Falcon 9 — could launch in the weeks ahead.",2018-01-22T18:25:51+0000
6,"Mr. Musk agreed to stay as chief executive for 10 years, with compensation tied to $50 billion leaps in Tesla’s valuation. Otherwise, he makes zero.",2018-01-23T08:00:24+0000
7,"Mr. Musk agreed to stay as chief executive for 10 years, with compensation tied to $50 billion leaps in Tesla’s valuation. Otherwise, he makes zero.",2018-01-23T08:00:24+0000
8,"The next chairman of the Federal Reserve was backed by 85 senators, more than enough to confirm him as the successor to Janet Yellen.",2018-01-23T12:27:23+0000
9,"The next chairman of the Federal Reserve was backed by 85 senators, more than enough to confirm him as the successor to Janet Yellen.",2018-01-23T12:27:23+0000
10,"The revenue and market capitalization targets for 2028 may seem off the charts, but one example to follow might be Jeff Bezos and Amazon.",2018-01-23T23:38:59+0000
11,"The revenue and market capitalization targets for 2028 may seem off the charts, but one example to follow might be Jeff Bezos and Amazon.",2018-01-23T23:38:59+0000
0,Elon Musk disrupted the business of sending rockets into space and has now achieved a milestone in spaceflight by launching the most powerful rocket currently operating in the world.,2018-02-06T10:00:21+0000
1,"The electric-car maker, reporting another quarterly loss, is scrambling to root out glitches in the manufacturing of its first mass-market offering.",2018-02-07T22:16:58+0000
2,"The electric-car maker, reporting another quarterly loss, is scrambling to root out glitches in the manufacturing of its first mass-market offering.",2018-02-07T22:16:58+0000
3,"In this week’s tech newsletter, a look at Apple’s new smart speaker, the Waymo vs. Uber trial and a billionaire’s rocket (plus his cherry red convertible).",2018-02-09T14:00:01+0000
4,"If Washington shuts down, companies will step up. Do we really want that?",2018-02-10T19:30:02+0000
5,"Elon Musk is flying high, despite Model 3 delays.",2018-02-12T17:29:32+0000
6,"Elon Musk is flying high, despite Model 3 delays.",2018-02-12T17:29:32+0000
7,"Before her stroke, Ma was an adventurous traveler: the Amazon, the Nile, the Galápagos. Now, she’s planning on tagging along with Elon Musk to Mars.",2018-02-27T16:53:10+0000
0,"Porsche’s Mission E models will compete with Tesla’s Model S and Model X, but the German automaker isn’t focused just on high-performance vehicles. It’s getting into charging, too.",2018-03-06T10:19:03+0000
1,"The president of Chile, China’s foreign minister and the head of the European Central Bank all weighed in on President Trump's metals tariffs.",2018-03-08T22:06:34+0000
2,"Is Lloyd Blankfein, the chief executive of Goldman Sachs, planning on stepping down “as soon as the end of the year?”",2018-03-09T12:41:02+0000
3,"Kimmel said, “Now you can give money to a porn star — just like the president of the United States.”",2018-03-16T07:54:26+0000
4,"Mr. Musk deleted the Facebook pages of two of his companies, SpaceX and Tesla. He and the Facebook C.E.O., Mark Zuckerberg, have, er, not always gotten along.",2018-03-23T17:54:05+0000
5,"Mr. Musk deleted the Facebook pages of two of his companies, SpaceX and Tesla. He and the Facebook C.E.O., Mark Zuckerberg, have, er, not always gotten along.",2018-03-23T17:54:05+0000
6,Stocks on Wall Street surged on signs of easing trade tensions.,2018-03-26T11:17:30+0000
7,"If the Trump administration pursues ways to curtail the company, it would meet sizable obstacles.",2018-03-29T10:40:59+0000
8,"Production delays, a recall and other problems have presented the electric-car maker and its founder, Elon Musk, with a crisis of confidence among investors.",2018-03-29T23:56:28+0000
9,"Production delays, a recall and other problems have presented the electric-car maker and its founder, Elon Musk, with a crisis of confidence among investors.",2018-03-29T23:56:28+0000
10,More questions were raised about the safety of the company’s self-driving technology after a second fatal crash in which the Autopilot system had been engaged.,2018-03-31T04:11:15+0000
11,"The company said a Model X was using Autopilot when it hit a concrete divider on March 23. The system, one analyst said, “works fine, until it suddenly doesn’t.”",2018-03-31T20:08:35+0000
12,"The company said a Model X was using Autopilot when it hit a concrete divider on March 23. The system, one analyst said, “works fine, until it suddenly doesn’t.”",2018-03-31T20:08:35+0000
0,"After teasing “important news” to come, he tweeted: “Tesla has gone completely and totally bankrupt. So bankrupt, you can’t believe it.”",2018-04-02T00:18:52+0000
1,"After teasing “important news” to come, he tweeted: “Tesla has gone completely and totally bankrupt. So bankrupt, you can’t believe it.”",2018-04-02T00:18:52+0000
2,"For months, the stock market plowed through the obstacles the Trump administration threw in its way. Now, the S.&P. 500 is down more than 10 percent from its high.",2018-04-02T10:38:39+0000
3,"For months, the stock market plowed through the obstacles the Trump administration threw in its way. Now, the S.&P. 500 is down more than 10 percent from its high.",2018-04-02T10:38:39+0000
4,"The electric-car maker said output of its first mass-market offering, the Model 3, was up to 2,000 a week. But that’s still short of the goal set by Elon Musk.",2018-04-03T13:34:14+0000
5,"The electric-car maker said output of its first mass-market offering, the Model 3, was up to 2,000 a week. But that’s still short of the goal set by Elon Musk.",2018-04-03T13:34:14+0000
6,"Tesla’s inability to meet production goals and the E.P.A.’s easing of mileage rules may delay electrification of vehicles, but it still will happen.",2018-04-04T01:23:43+0000
7,"Tesla’s inability to meet production goals and the E.P.A.’s easing of mileage rules may delay electrification of vehicles, but it still will happen.",2018-04-04T01:23:43+0000
8,A test drive shows the allure of the company’s mass-market electric car and limitations of its Autopilot system.,2018-04-05T15:46:42+0000
9,The Australian rust belt city of Adelaide wants to replicate the same innovation model that has revived American cities like Chattanooga and Pittsburgh.,2018-04-09T14:13:01+0000
10,First-quarter results from the big banks could offer insights into the issues buffeting the financial markets and the global economy.,2018-04-12T11:15:17+0000
11,The maker of electric cars expects to idle its assembly line for several days to clear impediments that have held production well below the company’s targets.,2018-04-17T03:10:23+0000
12,The maker of electric cars expects to idle its assembly line for several days to clear impediments that have held production well below the company’s targets.,2018-04-17T03:10:23+0000
13,"Days after a news report focused on conditions at the plant, a California agency said it was investigating an episode that left a millwright’s jaw broken.",2018-04-20T23:14:38+0000
14,"Days after a news report focused on conditions at the plant, a California agency said it was investigating an episode that left a millwright’s jaw broken.",2018-04-20T23:14:38+0000
15,"Two new books, “The Space Barons” and “Rocket Billionaires,” tell the story of the entrepreneurial push to leave Earth.",2018-04-24T09:00:08+0000
16,"The British man was barred from driving for 18 months after being videotaped sitting with his hands behind his head, cruising at 40 miles per hour in “heavy” traffic.",2018-04-29T14:02:21+0000
17,A crucial deadline will expire on Tuesday for six U.S. allies temporarily exempted from steel and aluminum trade tariffs. Apple and Tesla report earnings.,2018-04-29T19:18:19+0000
0,The chief executive said the electric-car maker would be profitable in the second half of the year if it met its production goals.,2018-05-02T20:53:56+0000
1,The chief executive said the electric-car maker would be profitable in the second half of the year if it met its production goals.,2018-05-02T20:53:56+0000
2,The United States has an expertise advantage in trade negotiations with China; solar tariffs are scrambling the industry; and Tesla’s “bizarre” conference call sent shares sliding.,2018-05-03T11:24:39+0000
3,The United States has an expertise advantage in trade negotiations with China; solar tariffs are scrambling the industry; and Tesla’s “bizarre” conference call sent shares sliding.,2018-05-03T11:24:39+0000
4,A contentious conference call with analysts after Tesla’s earnings announcement sent shares of the electric-car maker sharply lower.,2018-05-03T16:25:14+0000
5,A contentious conference call with analysts after Tesla’s earnings announcement sent shares of the electric-car maker sharply lower.,2018-05-03T16:25:14+0000
6,"A tiff between Warren Buffett and Elon Musk reignited over the weekend. But the two do have common ground, and betting against either is risky.",2018-05-07T20:59:12+0000
