,news,date
16,"Daimler reported unexpectedly strong profits, underlining a rebound by traditional carmakers despite the pandemic.",2021-02-18T19:21:08+0000
17,"Daimler reported unexpectedly strong profits, underlining a rebound by traditional carmakers despite the pandemic.",2021-02-18T19:21:08+0000
18,They’re still cars. Technology can’t cure America of its addiction to the automobile.,2021-02-18T20:00:07+0000
19,"Even before G.M. announced it would work toward eliminating emissions from its vehicles, more automakers were putting E.V.s in their showrooms. Here’s a roundup.",2021-02-21T04:20:07+0000
20,"The top 25 hedge fund managers earned $32 billion last year, according to Institutional Investor’s latest rankings.",2021-02-22T12:09:37+0000
21,We the people need to take more control of how we move into the brave new worlds beyond our planet.,2021-02-26T10:00:27+0000
22,"A series of announcements has not only reversed the decline of Canada’s auto industry, but has also set it on the path to electrification.",2021-02-26T23:01:59+0000
0,"Two earlier flights of the Starship rocket crashed spectacularly. This one returned to the ground in one piece, then blew up.",2021-03-03T18:03:20+0000
1,"SpaceX successfully launched and landed its Starship rocket prototype this month, an important milestone for the company’s founder, Elon Musk, and his hope to one day send humans to Mars and beyond.",2021-03-04T00:53:16+0000
2,"The 10 percent threshold for a correction is arbitrary, but it is often an indication that investors have turned more pessimistic about the markets.",2021-03-04T19:35:29+0000
3,Investors appear to be reconsidering the high share price as other automakers offer more electric vehicles.,2021-03-05T17:43:10+0000
4,"The country’s stance would seem to put it on the wrong side of market trends. But with its huge investment in gasoline-electric hybrids, it has big reasons to proceed slowly.",2021-03-09T10:00:12+0000
5,"The Tesla boss and digital prankster is striking a chord, at a time of disillusionment with the tech industry and its leading tycoons.",2021-03-11T15:29:33+0000
6,"The Tesla boss and digital prankster is striking a chord, at a time of disillusionment with the tech industry and its leading tycoons.",2021-03-11T15:29:33+0000
7,"The plant, in Fremont, Calif., resumed operations last May in defiance of guidelines issued by local public health officials.",2021-03-13T19:28:29+0000
8,"The plant, in Fremont, Calif., resumed operations last May in defiance of guidelines issued by local public health officials.",2021-03-13T19:28:29+0000
9,The narrative that the private sector drives innovation is only half the story.,2021-03-15T09:00:09+0000
10,"The data provides the first glimpse into virus cases at Tesla, whose chief executive, Elon Musk, had played down the severity of the pandemic",2021-03-15T11:59:29+0000
11,"The data provides the first glimpse into virus cases at Tesla, whose chief executive, Elon Musk, had played down the severity of the pandemic",2021-03-15T11:59:29+0000
12,The German carmaker outlined ambitious goals to build battery factories as it ties its fate to electric cars.,2021-03-15T19:43:37+0000
13,"Federal regulators are investigating 23 recent accidents in which drivers were, or may have been, using the automatic steering and braking system.",2021-03-23T07:00:08+0000
14,The electric-car maker will hold the digital currency and handle the crypto transactions internally.,2021-03-24T12:15:24+0000
15,The electric-car maker will hold the digital currency and handle the crypto transactions internally.,2021-03-24T12:15:24+0000
16,The board required that Tesla reinstate the employee and that Mr. Musk delete the tweet. It also required that the company amend its confidentiality agreement.,2021-03-25T22:57:50+0000
17,The board required that Tesla reinstate the employee and that Mr. Musk delete the tweet. It also required that the company amend its confidentiality agreement.,2021-03-25T22:57:50+0000
18,Meet the four people who will take the first all-civilian rocket trip to orbit Earth.,2021-03-30T11:50:10+0000
0,"The sales numbers, which cover the entire world, came a day after General Motors and Ford Motor reported that their U.S. sales were up modestly.",2021-04-02T13:21:20+0000
1,"The mustangs at a Nevada office park are an example of the outrageous perks that businesses dangle to impress job candidates, but wildlife advocates are pushing back on efforts to market them.",2021-04-13T13:00:14+0000
2,"The mustangs at a Nevada office park are an example of the outrageous perks that businesses dangle to impress job candidates, but wildlife advocates are pushing back on efforts to market them.",2021-04-13T13:00:14+0000
3,"The EQS has a range of 770 kilometers or about 480 miles, according to Mercedes. If that figure is confirmed, the EQS would dethrone the Tesla Model S Long Range Plus as the electric car with the longest range.",2021-04-16T11:44:04+0000
4,Elon Musk’s company bested Jeff Bezos’ Blue Origin and others in the contest to carry American astronauts to the lunar surface.,2021-04-16T21:07:45+0000
5,"“No one was driving the vehicle” when the car crashed and burst into flames, killing two men, a constable said.",2021-04-18T22:12:40+0000
6,"“No one was driving the vehicle” when the car crashed and burst into flames, killing two men, a constable said.",2021-04-18T22:12:40+0000
7,"Two people died in the crash, and officials said no one had been behind the wheel. Elon Musk, Tesla’s chief executive, said recovered data showed “Autopilot was not enabled” in the vehicle.",2021-04-20T17:28:54+0000
8,"Two people died in the crash, and officials said no one had been behind the wheel. Elon Musk, Tesla’s chief executive, said recovered data showed “Autopilot was not enabled” in the vehicle.",2021-04-20T17:28:54+0000
9,"Test-driving Volkswagen’s ID.4, Ford’s Mustang Mach-E and Volvo’s XC40 Recharge: The green turf where Tesla has dominated for so long is poised to grow crowded.",2021-04-22T10:00:09+0000
10,"Musk, who runs Tesla and SpaceX, will become the rare “S.N.L.” host not from the worlds of entertainment, politics or sports.",2021-04-24T21:52:08+0000
11,"Musk, who runs Tesla and SpaceX, will become the rare “S.N.L.” host not from the worlds of entertainment, politics or sports.",2021-04-24T21:52:08+0000
12,The electric-car maker’s performance reflected increasing sales and production around the world.,2021-04-26T18:07:57+0000
13,The electric-car maker’s performance reflected increasing sales and production around the world.,2021-04-26T18:07:57+0000
14,The space agency picked Elon Musk’s company over two other bidders to take its astronauts back to the lunar surface.,2021-04-26T21:00:09+0000
15,Bitcoin and emissions credits helped it set a quarterly earnings record.,2021-04-27T11:53:52+0000
16,Bitcoin and emissions credits helped it set a quarterly earnings record.,2021-04-27T11:53:52+0000
17,"The company is charging tens of thousands of dollars more to cover roofs with its much-anticipated solar shingles, angering some customers.",2021-04-29T09:00:29+0000
18,"The company is charging tens of thousands of dollars more to cover roofs with its much-anticipated solar shingles, angering some customers.",2021-04-29T09:00:29+0000
0,"The automaker should be able to win back some customers who drifted to Tesla, and hold onto the Tesla-curious.",2021-05-02T09:00:11+0000
1,"The cryptocurrency that started as a joke is up by roughly 14,000 percent this year.",2021-05-05T12:25:50+0000
2,"The choice to have the Tesla and SpaceX billionaire host “S.N.L.” has drawn praise, criticism and some veiled pushback from the show’s own cast members.",2021-05-07T09:00:13+0000
3,"The billionaire has been posting content creators’ work without credit. Some are frustrated; others, simply puzzled.",2021-05-07T09:00:27+0000
4,"The much-discussed Tesla and SpaceX executive took a self-deprecating approach, telling viewers, “I’m pretty good at running human in emulation mode.”",2021-05-09T07:38:38+0000
5,The ransomware attack on Colonial Pipeline is a sobering reminder about cybersecurity.,2021-05-10T11:46:34+0000
6,"Param Sharma, 25, was arrested on charges of reckless driving. “I’m about to go in the back seat right now,” he said after being released from jail.",2021-05-12T19:10:50+0000
7,"Elon Musk, Tesla’s chief executive, blamed the amount of energy, increasingly generated from fossil fuels, used by Bitcoin.",2021-05-13T00:25:17+0000
8,"Elon Musk, Tesla’s chief executive, blamed the amount of energy, increasingly generated from fossil fuels, used by Bitcoin.",2021-05-13T00:25:17+0000
9,"In a sudden U-turn, Tesla stopped accepting the cryptocurrency as payment. But why?",2021-05-13T11:16:47+0000
10,"In a sudden U-turn, Tesla stopped accepting the cryptocurrency as payment. But why?",2021-05-13T11:16:47+0000
11,"Elon Musk said Tesla would stop accepting Bitcoin as payment for cars, citing environmental reasons, a move that sent the price of the cryptocurrency plunging.",2021-05-13T13:41:30+0000
12,"Elon Musk said Tesla would stop accepting Bitcoin as payment for cars, citing environmental reasons, a move that sent the price of the cryptocurrency plunging.",2021-05-13T13:41:30+0000
13,It was once a parody — then he turned the cryptocurrency into his profit.,2021-05-14T09:57:06+0000
14,"Over all, nearly 7,000 investors lost $80 million in assorted cryptocurrency scams from October through March, according to a Federal Trade Commission report.",2021-05-18T12:00:25+0000
15,"Companies with Bitcoin on their balance sheets may be getting nervous. Three big corporate investors in Bitcoin are Tesla, MicroStrategy and Square.",2021-05-24T12:32:26+0000
16,"For years, those in a rural Texas village cherished living among nature and wildlife. Elon Musk’s SpaceX has brought new fears and the promise of an economic boost to one of America’s poorest corners.",2021-05-24T14:24:08+0000
17,"It can be fun to try out new products, but only if we know what we’re signing up for.",2021-05-24T17:10:08+0000
0,An analysis by ProPublica based on I.R.S. documents showed billionaires like Jeff Bezos and Elon Musk benefited from tax code loopholes and a focus on taxing income over wealth.,2021-06-08T15:34:03+0000
1,"The wealthiest Americans live by a different set of rules, lavishly spending money that isn’t taxed as income.",2021-06-08T23:05:05+0000
2,A bombshell report raises questions about the tax bills of the wealthy.,2021-06-09T11:56:45+0000
3,A ProPublica report showing how little many of America’s wealthiest paid in taxes raises that question. Also: Covid proms.,2021-06-09T16:42:32+0000
4,A new investigation confirms that the ultrarich don’t pay taxes like the rest of us. Should they?,2021-06-10T22:00:03+0000
5,"The journalist Jesse Eisinger breaks down the ProPublica investigation into how little the uber-rich pay in taxes, and what that means for the rest of us.",2021-06-14T09:00:09+0000
6,How a powerful industry conquered the U.S. tax system.,2021-06-14T11:23:32+0000
7,Leaked documents have reignited a long-simmering debate: Why are the ultrawealthy taxed so differently from those who earn far less?,2021-06-15T10:00:08+0000
8,The American idealization of wealthy mavericks isn't confined to the pages of comic books. ,2021-06-20T13:30:04+0000
9,"With the pandemic starting to ease in the United States, many had expected a year of wild investments to slow. It hasn’t. Yet.",2021-06-23T09:00:24+0000
10,Federal safety regulators told automakers to provide more information about accidents involving cars and trucks with automation technology.,2021-06-29T15:55:47+0000
11,Federal safety regulators told automakers to provide more information about accidents involving cars and trucks with automation technology.,2021-06-29T15:55:47+0000
0,"A former Tesla executive, she ran a family foundation that focuses on environmental sustainability. Her jewelry company uses recycled metals.",2021-07-01T17:46:01+0000
1,"Tesla said sales doubled in the second quarter, but Ford reported a more modest increase as the industry grapples with a semiconductor shortage.",2021-07-02T12:50:04+0000
2,"A California family that lost a 15-year-old boy when a Tesla hit its pickup truck is suing the company, claiming its Autopilot system was partly responsible.",2021-07-05T20:30:28+0000
3,"A California family that lost a 15-year-old boy when a Tesla hit its pickup truck is suing the company, claiming its Autopilot system was partly responsible.",2021-07-05T20:30:28+0000
4,"The talk show host, the R&B singer Khalid and others added glitz to an event full of rocket science.",2021-07-11T15:34:07+0000
5,Didi Chuxing is just the tip of the iceberg.,2021-07-13T11:25:54+0000
6,"With the suborbital flights made by Jeff Bezos and Richard Branson this month, the privatization of the space industry has crossed the point of no return.",2021-07-21T18:56:46+0000
7,"Elon Musk wanted to tap German engineering expertise, but may have gotten more local culture than he had bargained for.",2021-07-22T09:00:15+0000
8,"Elon Musk wanted to tap German engineering expertise, but may have gotten more local culture than he had bargained for.",2021-07-22T09:00:15+0000
9,It’s giving retail investors much more of its I.P.O. than is the norm.,2021-07-22T11:11:22+0000
10,"Two new books, Eric Berger’s “Liftoff” and Tim Higgins’s “Power Play,” explore Musk’s terrestrial and extraterrestrial pursuits — and what has made him so successful.",2021-07-23T17:32:59+0000
11,"Two new books, Eric Berger’s “Liftoff” and Tim Higgins’s “Power Play,” explore Musk’s terrestrial and extraterrestrial pursuits — and what has made him so successful.",2021-07-23T17:32:59+0000
12,The electric car company made $1 billion in the second quarter as its revenue roughly doubled from the same period a year earlier.,2021-07-26T19:46:15+0000
13,The electric car company made $1 billion in the second quarter as its revenue roughly doubled from the same period a year earlier.,2021-07-26T19:46:15+0000
14,We’re all Tesla’s guinea pigs.,2021-07-30T09:00:16+0000
15,We’re all Tesla’s guinea pigs.,2021-07-30T09:00:16+0000
16,The Government Accountability Office said a $2.9 billion award to SpaceX to build the next lunar lander for astronauts would stand.,2021-07-30T21:24:29+0000
0,"Unscrupulous, boundary-pushing executives seem to be an inescapable part of the most exciting technology.",2021-08-03T16:24:12+0000
1,A push to increase sales of electric vehicles favors companies that already have all-electric cars on the market and could penalize those that don’t.,2021-08-06T07:00:10+0000
2,"President Biden has made conversion to E.V.s a pillar of climate policy. But government incentives mostly help affluent buyers, not average families.",2021-08-09T17:51:08+0000
3,A longtime critic of the Tesla chief executive explains why his bets against the car company haven’t paid off.,2021-08-12T11:53:21+0000
4,A longtime critic of the Tesla chief executive explains why his bets against the car company haven’t paid off.,2021-08-12T11:53:21+0000
5,It will be the broadest look yet at Tesla’s assisted-driving technology. The National Highway Traffic Safety Administration has the authority to force a recall or require new safety features.,2021-08-16T12:17:26+0000
6,It will be the broadest look yet at Tesla’s assisted-driving technology. The National Highway Traffic Safety Administration has the authority to force a recall or require new safety features.,2021-08-16T12:17:26+0000
7,A 2019 crash in Florida highlights how gaps in Tesla’s driver-assistance system and distractions can have tragic consequences.,2021-08-17T09:00:23+0000
8,A 2019 crash in Florida highlights how gaps in Tesla’s driver-assistance system and distractions can have tragic consequences.,2021-08-17T09:00:23+0000
9,The lawsuit could have far-reaching consequences for the entire blank-check industry.,2021-08-17T12:10:56+0000
10,"As the company deals with government scrutiny of its driver-assistance technology, an add-on kit sold for up to $10,000 is also getting more attention.",2021-08-20T15:24:30+0000
11,"As the company deals with government scrutiny of its driver-assistance technology, an add-on kit sold for up to $10,000 is also getting more attention.",2021-08-20T15:24:30+0000
12,Auto analysts consider Rivian one of the most viable electric vehicle start-ups in what is expected to be a very competitive market.,2021-08-27T14:53:34+0000
13,Elon Musk has put up $100 million in prize money for a way to extract carbon from the atmosphere.,2021-08-30T19:06:29+0000
0,The request by the National Highway Traffic Safety Administration is part of an investigation into Tesla cars crashing into parked emergency vehicles.,2021-09-01T18:32:03+0000
1,"The United States has about 100,000 public chargers, far fewer than Europe and China. It needs 10 times as many, auto experts say, to complete the switch from combustion engine vehicles.",2021-09-07T09:00:23+0000
2,Small trucks from Ford and Hyundai are joining a growing field of electric models as America’s go-to vehicle adapts to an evolving market.,2021-09-08T07:00:09+0000
3,"The four-person team raised the number of people in space to 14 for about a day, passing a record set in 2009.",2021-09-16T05:52:56+0000
4,"Tesla, which makes about two-thirds of electric vehicles sold in the United States, has long produced the cars with the best range.",2021-09-16T12:30:21+0000
5,All places are not equal when it comes to the infrastructure that supports electric vehicles.,2021-09-16T13:30:06+0000
6,"The rivalry between Elon Musk and Jeff Bezos over spaceflight is well known, but the two made nice on Twitter over the Inspiration4 launch.",2021-09-17T01:11:20+0000
7,One thing’s for sure: Escaping the dung heap doesn’t come cheap.,2021-09-21T06:30:13+0000
0,"The company, which is backed by Amazon and Ford, is seeking to sell shares in one of the biggest initial public offerings of the year.",2021-10-01T22:31:40+0000
1,"The company, which is backed by Amazon and Ford, is seeking to sell shares in one of the biggest initial public offerings of the year.",2021-10-01T22:31:40+0000
2,The electric-car maker has weathered the global shortage of semiconductors better than more established rivals.,2021-10-02T17:42:52+0000
3,The electric-car maker has weathered the global shortage of semiconductors better than more established rivals.,2021-10-02T17:42:52+0000
4,The National Highway Traffic Safety Administration said battery fires in Tesla’s electric vehicles when no crash was involved were “rare events.”,2021-10-04T20:35:42+0000
5,"A jury agreed with Owen Diaz that Tesla had created a hostile environment at its factory in Fremont, Calif.",2021-10-05T02:18:30+0000
6,"Elon Musk announced the move at the company’s annual shareholder meeting, hosted at a factory Tesla is building near Austin.",2021-10-07T09:00:52+0000
7,"Elon Musk announced the move at the company’s annual shareholder meeting, hosted at a factory Tesla is building near Austin.",2021-10-07T09:00:52+0000
8,"In a thoroughly modern blurring of reality and fiction, William Shatner will soar to space with Blue Origin. Do you care?",2021-10-07T17:57:46+0000
9,"In a thoroughly modern blurring of reality and fiction, William Shatner will soar to space with Blue Origin. Do you care?",2021-10-07T17:57:46+0000
10,"While its C.E.O., Elon Musk, and the state’s conservative lawmakers share libertarian sensibilities, they differ greatly on climate change and renewable energy.",2021-10-08T17:33:54+0000
11,"While its C.E.O., Elon Musk, and the state’s conservative lawmakers share libertarian sensibilities, they differ greatly on climate change and renewable energy.",2021-10-08T17:33:54+0000
12,New data show that companies are increasingly hiring outside of places like Silicon Valley.,2021-10-08T19:05:06+0000
13,New data show that companies are increasingly hiring outside of places like Silicon Valley.,2021-10-08T19:05:06+0000
14,"In a letter, the National Highway Traffic Safety Administration reminded Tesla that federal law requires automakers to initiate recalls if they find defects that pose a safety risk.",2021-10-13T15:06:53+0000
15,"The automaker also reported a big jump in revenue, to $13.8 billion from $8.8 billion a year ago, as sales of the Model Y continue to rise.",2021-10-20T20:09:33+0000
16,"The automaker also reported a big jump in revenue, to $13.8 billion from $8.8 billion a year ago, as sales of the Model Y continue to rise.",2021-10-20T20:09:33+0000
17,A Harris County sheriff’s constable said in April that evidence at the scene of the accident suggested that no one was driving the car when it crashed.,2021-10-21T16:01:01+0000
18,"The order, to be fulfilled between now and the end of next year, is a sign of the growing momentum in the shift toward electric cars.",2021-10-25T12:25:11+0000
19,"The order, to be fulfilled between now and the end of next year, is a sign of the growing momentum in the shift toward electric cars.",2021-10-25T12:25:11+0000
20,"The car maker attained $1 trillion market value, but it’s different from others in that group in some big ways.",2021-10-26T11:54:53+0000
21,"They are tech titans, entertainment moguls and heirs to great fortunes. Their ranks grew during the pandemic, changing the political conversation around taxing the wealthy.",2021-10-28T19:42:01+0000
22,There is evidence the change to Meta is more than window dressing.,2021-10-29T11:21:00+0000
0,"Hertz had said that it would convert more than 20 percent of its rental fleet to Tesla’s cars, a deal that helped propel Tesla’s stock value beyond $1 trillion for the first time.",2021-11-02T13:16:01+0000
1,"Hertz had said that it would convert more than 20 percent of its rental fleet to Tesla’s cars, a deal that helped propel Tesla’s stock value beyond $1 trillion for the first time.",2021-11-02T13:16:01+0000
2,"Somehow, wealth beyond imagining isn’t enough.",2021-11-02T16:19:50+0000
3,"From Mars to the metaverse, tech moguls are forging a new kind of capitalism: an extreme, extraterrestrial version.",2021-11-04T09:00:18+0000
4,A federal judge rejected the argument by Jeff Bezos’ rocket company that NASA unfairly awarded a lunar lander contract to Elon Musk’s firm.,2021-11-04T15:58:49+0000
5,"He asked whether he should sell 10 percent of his stock, and Twitter voters said yes. Stock options he was granted in 2012 are “a ticking tax time bomb,” one expert said.",2021-11-08T10:00:08+0000
6,"He asked whether he should sell 10 percent of his stock, and Twitter voters said yes. Stock options he was granted in 2012 are “a ticking tax time bomb,” one expert said.",2021-11-08T10:00:08+0000
7,Is the Tesla chief about to sell a big chunk of his shares?,2021-11-08T12:41:59+0000
8,Is the Tesla chief about to sell a big chunk of his shares?,2021-11-08T12:41:59+0000
9,"Since Friday, Tesla has shed about $200 billion in market valuation.",2021-11-09T17:39:31+0000
10,"Since Friday, Tesla has shed about $200 billion in market valuation.",2021-11-09T17:39:31+0000
11,The sales so far were considerably short of the $20 billion worth he promised over the weekend that he would sell.,2021-11-11T00:11:56+0000
12,The sales so far were considerably short of the $20 billion worth he promised over the weekend that he would sell.,2021-11-11T00:11:56+0000
13,"The 2018 tweet, in which Mr. Musk claimed he had secured funding to take Tesla private, initially sent the automaker’s shares soaring. But they sank when it became clear that no such deal had been reached.",2021-11-16T18:53:38+0000
14,"The 2018 tweet, in which Mr. Musk claimed he had secured funding to take Tesla private, initially sent the automaker’s shares soaring. But they sank when it became clear that no such deal had been reached.",2021-11-16T18:53:38+0000
15,Peter Rawlinson engineered the Tesla Model S. His new Lucid Air sedan is a direct challenge to Tesla’s dominance.,2021-11-18T10:00:17+0000
16,Peter Rawlinson engineered the Tesla Model S. His new Lucid Air sedan is a direct challenge to Tesla’s dominance.,2021-11-18T10:00:17+0000
17,Shares in Lucid Motors and Rivian are soaring. Can that last?,2021-11-18T12:21:14+0000
18,The worldwide shift to electric vehicles is critical in the fight against climate change. Here's how the most important part of these cars is made.,2021-11-20T10:00:01+0000
19,"Herbert Diess, the chief executive, seeks to cast VW as a dynamic, modern company, but his style risks the ire of its powerful works council.",2021-11-24T10:00:25+0000
20,"The electric car company is helping Chinese companies become global players in the emerging industry, posing a competitive threat to traditional rivals.",2021-11-30T10:00:24+0000
21,"The electric car company is helping Chinese companies become global players in the emerging industry, posing a competitive threat to traditional rivals.",2021-11-30T10:00:24+0000
0,"The automaker may have undermined safety in designing its Autopilot driver-assistance system to fit its chief executive’s vision, former employees say.",2021-12-06T10:00:24+0000
1,"The automaker may have undermined safety in designing its Autopilot driver-assistance system to fit its chief executive’s vision, former employees say.",2021-12-06T10:00:24+0000
2,Ray Dalio is trying to explain comments about doing business there.,2021-12-06T13:09:07+0000
3,The feature raises fresh questions about whether Tesla is compromising safety as it rushes to add new technologies.,2021-12-07T10:00:17+0000
4,The feature raises fresh questions about whether Tesla is compromising safety as it rushes to add new technologies.,2021-12-07T10:00:17+0000
