,news,date
3,"To a degree unseen in any other mogul, the world’s richest man acts on impulse and the belief that he is absolutely right.",2022-05-03T07:00:21+0000
4,"To a degree unseen in any other mogul, the world’s richest man acts on impulse and the belief that he is absolutely right.",2022-05-03T07:00:21+0000
5,The origins and meaning of Black Twitter.,2022-05-03T09:00:13+0000
6,Elon Musk’s plans to buy the social media platform were met with glee by some on the right. But will they all come back?,2022-05-03T09:00:21+0000
7,"You can subscribe to music and movies. Why not travel? New services target frequent travelers, luxury lovers, bargain shoppers and even Tesla fans.",2022-05-04T09:00:18+0000
8,"Mr. Musk, who has a deal to buy the platform, said accounts for casual users would always remain free.",2022-05-04T14:28:28+0000
9,The apartheid era created all-white enclaves littered with anti-Black government propaganda and sheltered from the atrocities of apartheid.,2022-05-05T09:00:32+0000
10,"Fully electric vehicles have fewer fires than gasoline-powered and hybrid cars, and their crash protection is at least equivalent.",2022-05-05T10:00:08+0000
11,The filing lists a number of investment firms and other backers who will contribute $7 billion to the deal.,2022-05-05T11:43:55+0000
12,"Many marketers were already lukewarm on the service. Now, some may move their money elsewhere if the content moderation policies are relaxed.",2022-05-05T15:25:11+0000
13,Here’s what you need to know at the end of the day.,2022-05-05T21:13:42+0000
14,The Tesla challenger said it continued to have problems finding needed parts.,2022-05-05T21:44:43+0000
15,Twitter’s would-be owner brings a slew of financiers into the fold — and a wide range of views.,2022-05-05T23:00:05+0000
16,Twitter’s would-be owner brings a slew of financiers into the fold — and a wide range of views.,2022-05-05T23:00:05+0000
17,"The chief executive’s debt load, his divided attention and Twitter’s own challenges could all take a toll on his electric-car company.",2022-05-06T09:00:28+0000
18,"The chief executive’s debt load, his divided attention and Twitter’s own challenges could all take a toll on his electric-car company.",2022-05-06T09:00:28+0000
19,The Federal Reserve’s efforts to slow inflation might hit hiring as well.,2022-05-06T13:09:10+0000
20,"The company recently moved to Texas, which is home to some of the country’s most restrictive abortion laws.",2022-05-06T19:15:08+0000
21,"Here’s what Mr. Musk is projecting for Twitter’s finances over the next few years, according to a pitch deck he presented to investors.",2022-05-06T21:30:43+0000
22,The Federal Reserve approved its biggest rate increase since 2000. Investors joined Elon Musk’s deal to buy Twitter. Another inflation indicator comes out this week.,2022-05-08T11:00:08+0000
23,The Federal Reserve approved its biggest rate increase since 2000. Investors joined Elon Musk’s deal to buy Twitter. Another inflation indicator comes out this week.,2022-05-08T11:00:08+0000
24,Readers discuss Mr. Musk’s promise of more “free speech” and his notion of Twitter as a “town square.” Also: Tears and other subway memories.,2022-05-08T15:14:27+0000
25,"Mr. Musk has said he wants Twitter to be a forum for debate, and he called the barring of Mr. Trump “morally wrong.” The former president has said he would not rejoin the platform.",2022-05-10T17:53:31+0000
26,"After the Jan. 6 attack on the Capitol by supporters of President Donald J. Trump, social media sites including Twitter and Facebook were urged to limit hate speech and the glorification of violence on their platforms.",2022-05-10T21:06:20+0000
27,Here’s what you need to know at the end of the day.,2022-05-10T22:04:44+0000
28,America’s richest man tries to halt the liberal retreat from dynamism.,2022-05-11T09:00:18+0000
29,America’s richest man tries to halt the liberal retreat from dynamism.,2022-05-11T09:00:18+0000
30,"The teen mental health crisis. Also: Elon Musk, Donald Trump and Twitter; Vladimir Putin’s gambit; Russian TV; Penn Station; flying without masks.",2022-05-11T15:20:35+0000
31,"Kara Swisher, Ben Smith and Matt Belloni discuss the tumult at Netflix, CNN+ and more.",2022-05-12T09:00:14+0000
32,"The General Motors chief says efficiencies, innovations and learning from mistakes will allow her company to become a leader in electric vehicles.",2022-05-12T09:00:23+0000
33,An internal memo shared with employees said the platform’s general manager and general manager for revenue would be departing.,2022-05-12T16:45:54+0000
34,Mr. Musk said he wanted to confirm Twitter’s findings that spam and fake accounts make up less than 5 percent of its users.,2022-05-13T10:17:30+0000
35,Some early morning tweets fed into speculation that he could back out of the deal.,2022-05-13T13:59:30+0000
36,Some early morning tweets fed into speculation that he could back out of the deal.,2022-05-13T13:59:30+0000
37,They’re quieter and better for the climate. But snow and water create new technological challenges for designers.,2022-05-15T09:00:11+0000
38,Meet the new materials overpowering the electric economy.,2022-05-16T09:00:21+0000
39,Our documentary explores Tesla’s difficulty in making automated driving a reality.,2022-05-16T13:00:07+0000
40,Our documentary explores Tesla’s difficulty in making automated driving a reality.,2022-05-16T13:00:07+0000
41,"Mr. Musk has been creating confusion around whether the Twitter deal will close, causing the social media company’s share price to fall.",2022-05-16T21:22:20+0000
42,"Mr. Musk has been creating confusion around whether the Twitter deal will close, causing the social media company’s share price to fall.",2022-05-16T21:22:20+0000
43,Mr. Musk called on Twitter to provide more data about the number of spam and fake accounts on the social media site.,2022-05-17T08:39:05+0000
44,"Plus, latest crypto crash causes regulators to push for new investor protections.",2022-05-17T13:12:01+0000
45,"In a filing on Tuesday, Twitter said it was still committed to its agreement with Elon Musk and urged shareholders to vote in favor of it.",2022-05-17T14:11:22+0000
46,Here’s what you need to know at the end of the day.,2022-05-17T22:48:55+0000
47,S&P cited racial discrimination claims in deciding to exclude the electric carmaker from a listing of socially responsible companies.,2022-05-18T19:42:39+0000
48,S&P cited racial discrimination claims in deciding to exclude the electric carmaker from a listing of socially responsible companies.,2022-05-18T19:42:39+0000
49,The billionaire railed against E.S.G. after Tesla was dropped from a popular index.,2022-05-19T12:34:48+0000
50,The billionaire railed against E.S.G. after Tesla was dropped from a popular index.,2022-05-19T12:34:48+0000
51,Here’s what you need to know at the end of the day.,2022-05-19T21:43:42+0000
52,Here’s what you need to know at the end of the day.,2022-05-19T21:43:42+0000
53,A New York Times Presents documentary team had to assemble a visionary’s vision without his participation.,2022-05-20T07:00:07+0000
54,A New York Times Presents documentary team had to assemble a visionary’s vision without his participation.,2022-05-20T07:00:07+0000
55,The billionaire’s increasingly erratic behavior on Twitter distracts from the terrible math behind his bid to buy it.,2022-05-20T09:00:24+0000
56,The billionaire’s increasingly erratic behavior on Twitter distracts from the terrible math behind his bid to buy it.,2022-05-20T09:00:24+0000
57,"Musk has denied claims of sexual misconduct against an employee, saying that Insider wrote the story to interfere with his acquisition of Twitter.",2022-05-20T13:15:53+0000
58,The world of deal making has always been rough and tumble. But Mr. Musk blows any predecessors away.,2022-05-20T13:26:46+0000
59,Production problems in China and Elon Musk’s pursuit of Twitter are leading investors to wonder whether the electric car company is worth as much as they thought.,2022-05-20T17:55:58+0000
60,Production problems in China and Elon Musk’s pursuit of Twitter are leading investors to wonder whether the electric car company is worth as much as they thought.,2022-05-20T17:55:58+0000
61,Technology titans are missing that old adulation.,2022-05-23T23:00:11+0000
62,Technology titans are missing that old adulation.,2022-05-23T23:00:11+0000
63,"Gwynne Shotwell, SpaceX’s president and chief operating officer, addressed sexual harassment allegations against Mr. Musk in a company email last week.",2022-05-23T23:48:55+0000
64,"Parag Agrawal, Twitter’s chief executive, is grappling with a takeover where nobody “would want to be in those shoes.”",2022-05-25T16:42:21+0000
65,"Twitter did not do enough to tell its users that the personal data it had collected was used partly to help marketers target ads, the F.T.C. and Justice Department said.",2022-05-25T22:31:49+0000
66,"The $61 billion combination is one of the biggest of the year, and may signal more tech deals to come.",2022-05-26T12:27:03+0000
67,"The $61 billion combination is one of the biggest of the year, and may signal more tech deals to come.",2022-05-26T12:27:03+0000
68,Online hoax allegations are an insult to family members and should be taken down.,2022-05-26T22:45:05+0000
69,The regulator questioned whether the Tesla chief executive had disclosed his stake at the right time.,2022-05-27T16:03:33+0000
0,His long list of unfulfilled commitments wildly exceeds his achievements.,2022-06-01T09:00:13+0000
1,His long list of unfulfilled commitments wildly exceeds his achievements.,2022-06-01T09:00:13+0000
2,The court blocks a Texas law after an emergency request from groups representing major tech companies like Facebook and Twitter.,2022-06-01T12:40:33+0000
3,"In emails to workers at SpaceX and Tesla, Mr. Musk said they were required to spend a minimum of 40 hours a week in the office.",2022-06-01T16:01:17+0000
4,"In emails to workers at SpaceX and Tesla, Mr. Musk said they were required to spend a minimum of 40 hours a week in the office.",2022-06-01T16:01:17+0000
5,Why does the billionaire Tesla C.E.O. even want Twitter? Two experts weigh in.,2022-06-02T09:00:14+0000
6,"With nearly twice as many open jobs as available workers and rising inflation, many economists and policymakers say a slowdown is just what the economy needs.",2022-06-03T12:58:34+0000
7,"The electric carmaker has been growing fast in recent years, but Elon Musk, its chief executive, appears to be concerned about a weakening economy.",2022-06-03T23:39:58+0000
8,"The electric carmaker has been growing fast in recent years, but Elon Musk, its chief executive, appears to be concerned about a weakening economy.",2022-06-03T23:39:58+0000
9,The President’s comment on Friday dismissing the billionaire entrepreneur is the latest barb in Biden’s unfortunate feud.,2022-06-06T13:50:37+0000
10,The President’s comment on Friday dismissing the billionaire entrepreneur is the latest barb in Biden’s unfortunate feud.,2022-06-06T13:50:37+0000
11,Mr. Musk’s lawyers said Twitter was “actively resisting” his requests.,2022-06-06T13:52:11+0000
12,"The Lone Star State enters the Musk-Twitter fray, highlighting Texas’ willingness, and Republicans in general, to break with traditional free market thinking.",2022-06-07T13:38:07+0000
13,What space fantasies can tell us about terrestrial trade.,2022-06-07T18:15:06+0000
14,What space fantasies can tell us about terrestrial trade.,2022-06-07T18:15:06+0000
15,"Automakers and technology companies say they are making driving safer, but verifying these claims is difficult.",2022-06-08T09:00:34+0000
16,"Automakers and technology companies say they are making driving safer, but verifying these claims is difficult.",2022-06-08T09:00:34+0000
17,"For Ken Paxton, the state attorney general, there are positives. Aligning with Elon Musk? Check. Politically helpful? Check.",2022-06-08T17:00:28+0000
18,"The move may make it tougher for Mr. Musk, who has said he is not getting enough information from the company, to end the $44 billion acquisition.",2022-06-08T18:46:25+0000
19,"Will he buy Twitter? Nobody knows — but what does it matter, as long as you keep paying attention?",2022-06-09T15:00:13+0000
20,"Will he buy Twitter? Nobody knows — but what does it matter, as long as you keep paying attention?",2022-06-09T15:00:13+0000
21,NHTSA will take a broad look at whether the electric-car maker’s driver-assistance system can increase the risk of crashes.,2022-06-09T16:27:19+0000
22,NHTSA will take a broad look at whether the electric-car maker’s driver-assistance system can increase the risk of crashes.,2022-06-09T16:27:19+0000
23,Inflation recorded another increase; the Fed will probably follow with a new rate bump. And Wells Fargo is under criminal investigation.,2022-06-12T11:00:09+0000
24,It’s the former U.S. Attorney for the Southern District of New York’s first legal role since he was fired by Donald Trump in 2017.,2022-06-13T12:58:57+0000
25,The National Highway Traffic Safety Administration released data on 10 months of crashes involving cars with automated components. A few were fatal.,2022-06-15T13:00:08+0000
26,"Musk will take questions from employees as his $44 billion acquisition of the company moves ahead, despite his hand-wringing about bots.",2022-06-16T12:14:15+0000
27,The employees said that the chief executive’s behavior online was “a frequent source of distraction and embarrassment.”,2022-06-16T17:08:15+0000
28,"Mr. Musk answered questions from Twitter’s 8,000 workers for the first time in a virtual meeting on Thursday.",2022-06-16T18:08:33+0000
29,"Mr. Musk answered questions from Twitter’s 8,000 workers for the first time in a virtual meeting on Thursday.",2022-06-16T18:08:33+0000
30,"In an email, Gwynne Shotwell, SpaceX’s president, said the letter had made other employees “feel uncomfortable, intimidated and bullied.”",2022-06-17T06:16:49+0000
31,"Tesla shifted to selling cars entirely online in 2019. Now, some established automakers, like Ford, are talking about taking a similar approach.",2022-06-21T09:00:15+0000
32,"Tesla shifted to selling cars entirely online in 2019. Now, some established automakers, like Ford, are talking about taking a similar approach.",2022-06-21T09:00:15+0000
33,"The launch brings the country closer to its ambition of becoming a player in the space industry, no longer reliant on technology from other countries.",2022-06-21T11:40:15+0000
34,The gap with workers widened even further as public companies granted top executives rich pay packages partly inspired by Tesla.,2022-06-25T09:00:21+0000
35,The gap with workers widened even further as public companies granted top executives rich pay packages partly inspired by Tesla.,2022-06-25T09:00:21+0000
36,A risky compensation plan at Tesla paid off and laid the groundwork that has pushed other executives’ compensation sky high.,2022-06-27T13:27:50+0000
37,A risky compensation plan at Tesla paid off and laid the groundwork that has pushed other executives’ compensation sky high.,2022-06-27T13:27:50+0000
38,Silicon Valley breeds narcissists who run their companies as ideological vanity projects.,2022-06-28T09:00:20+0000
39,"In the “Sway” finale, the tech journalist and podcast host revisits conversations with Nancy Pelosi and Monica Lewinsky and answers listeners’ questions.",2022-06-30T09:00:11+0000
40,"Tech moguls may be more powerful — and unholy — than ever, but consumers don’t have to be complacent.",2022-06-30T20:01:05+0000
0,The decline in deliveries by the electric carmaker in the second quarter was the first drop since the beginning of 2020. The main culprit was factory shutdowns in China.,2022-07-02T16:46:01+0000
1,"Name-change documents filed in Texas show that the outspoken entrepreneur recently fathered twins with Shivon Zilis, a director at one of his companies.",2022-07-07T20:09:51+0000
2,"Mr. Musk has appeared reluctant to proceed with the $44 billion agreement, citing uncertainty about the number of fake accounts on the platform.",2022-07-08T10:17:49+0000
3,Plus: Elon Musk may be preparing for the next chapter in his Twitter takeover journey — court.,2022-07-08T12:02:13+0000
4,"In a regulatory filing on Friday, Mr. Musk said Twitter was in “material breach” of the acquisition agreement.",2022-07-08T21:30:35+0000
5,"Bots can tweet at people, share tweets, follow and be followed by other people. And there are good bots and bad.",2022-07-09T15:25:49+0000
6,Most legal experts say Twitter has the upper hand. But Musk revels in brinkmanship.,2022-07-09T19:46:17+0000
7,"Well, it won’t be Elon Musk.",2022-07-11T09:00:13+0000
8,"Shares have lost a third of their value since April 25, when the company’s board accepted Mr. Musk’s offer.",2022-07-11T13:21:48+0000
9,"Twitter has sued Mr. Musk to force a sale of the company, and the case will be determined by a 230-year-old court in Delaware.",2022-07-11T19:39:48+0000
10,"Mr. Musk swooped in and exposed Twitter’s lack of business and financial prospects. After criticizing the company’s weaknesses, he now wants to back out of buying it.",2022-07-11T21:19:18+0000
11,"In April, the world’s richest man agreed to pay $44 billion for the social network. Now he wants the deal canceled.",2022-07-12T10:00:03+0000
12,One thing is for sure: Musk has left Twitter worse off than it was when he said he would buy it.,2022-07-12T12:43:34+0000
13,"The question of whether Elon Musk must buy Twitter, as he agreed to do in April, is headed to a court in Delaware.",2022-07-12T20:58:34+0000
14,Here are some of the company’s main legal arguments.,2022-07-13T00:19:31+0000
15,"The company contends that Musk breached his agreement to buy it by not using “reasonable best efforts” to close the deal, and so has no right to bail out.",2022-07-13T12:03:41+0000
16,A deal of this magnitude can generate value for Twitter and create stability for future mergers.,2022-07-14T09:00:09+0000
17,"A scarcity of semiconductors and raw materials held back production, but buyers remain enthusiastic.",2022-07-14T09:00:18+0000
18,The agency questioned whether a tweet Mr. Musk sent in May about the acquisition of Twitter should have been disclosed to the agency and investors.,2022-07-14T15:17:45+0000
19,"Mr. Musk formally responded to Twitter’s attempt to force him to buy the company, arguing that there was no reason to hurry the case.",2022-07-15T21:24:19+0000
20,Inflation in June was high. The euro tumbled to parity with the U.S. dollar. And central banks around the world are raising interest rates.,2022-07-17T11:00:07+0000
21,"Twitter had sought to expedite the case by requesting a trial in September, which Mr. Musk had countered by asking for a trial in February.",2022-07-19T17:00:54+0000
22,"If Elon Musk buys Twitter, there are steps he could take to expand the boundaries of online expression.",2022-07-19T18:35:23+0000
23,Britain sets a heat record.,2022-07-20T03:36:43+0000
24,"Judge Kathaleen McCormick granted the social media giant’s request for an expedited hearing. Now, the two sides are gearing up for a trial in October.",2022-07-20T12:37:45+0000
25,The world’s largest maker of electric cars struggled with production problems in China.,2022-07-20T20:46:42+0000
26,The world’s largest maker of electric cars struggled with production problems in China.,2022-07-20T20:46:42+0000
27,And a SoftBank-backed start up that wants to save your 401(k).,2022-07-21T12:07:08+0000
28,And a SoftBank-backed start up that wants to save your 401(k).,2022-07-21T12:07:08+0000
29,The social media company swung to a loss in the second quarter and cited “uncertainty” over its pending takeover by the billionaire Tesla chief executive as a factor.,2022-07-22T12:27:28+0000
30,Several signs of economic stress may keep the Fed from raising interest rates to a full percentage point.,2022-07-25T12:50:24+0000
31,"Tesla said it expected capital expenditures to be $6 billion to $8 billion in 2022, up from an April forecast of $5 billion to $7 billion.",2022-07-25T15:24:45+0000
32,"Tesla said it expected capital expenditures to be $6 billion to $8 billion in 2022, up from an April forecast of $5 billion to $7 billion.",2022-07-25T15:24:45+0000
0,Our documentary explores Tesla’s difficulty in making automated driving a reality.,2022-08-02T08:34:51+0000
1,Our documentary explores Tesla’s difficulty in making automated driving a reality.,2022-08-02T08:34:51+0000
2,"Twitter has sent out requests for information from the banks that are backing the billionaire’s purchase, which he is trying to walk away from.",2022-08-02T13:50:18+0000
3,"Elon Musk subpoenaed the banks advising Twitter in its deal, and Twitter sent subpoenas to several people close to Mr. Musk.",2022-08-04T14:10:11+0000
4,One proposal from investors that would allow investors to nominate directors to the electric car company’s board was approved.,2022-08-04T15:38:17+0000
5,One proposal from investors that would allow investors to nominate directors to the electric car company’s board was approved.,2022-08-04T15:38:17+0000
6,Twitter called the claims false and irrelevant in a high-profile legal fight over whether the billionaire can back out of a $44 billion deal to acquire the company.,2022-08-04T22:05:14+0000
7,There has been a surge in the sales of cars that can travel short distances on just electricity and have a gasoline engine for longer trips.,2022-08-05T09:00:25+0000
8,A state agency said the electric carmaker had misled the public in describing its driver-assistance service as autonomous.,2022-08-06T00:24:43+0000
9,A state agency said the electric carmaker had misled the public in describing its driver-assistance service as autonomous.,2022-08-06T00:24:43+0000
10,"Battery-powered vehicles are considered essential to the fight against climate change, but most models are aimed at the affluent.",2022-08-08T16:20:31+0000
11,The billionaire entrepreneur said he wanted “to avoid an emergency sale of Tesla stock” if he was forced to complete the buyout of the social media company.,2022-08-10T14:57:59+0000
12,The billionaire entrepreneur said he wanted “to avoid an emergency sale of Tesla stock” if he was forced to complete the buyout of the social media company.,2022-08-10T14:57:59+0000
13,"Carmakers may need several years to revamp their supply chains to meet new rules, but the legislation is still seen as a win for electric vehicles.",2022-08-12T09:00:26+0000
14,Owners of battery-powered cars sometimes struggle to refuel on longer trips because public chargers don’t work or malfunction while cars are plugged in.,2022-08-16T07:00:08+0000
15,"The new climate, tax and health law signed by President Biden extends a credit for electric vehicle buyers. But there are new strings attached that kick in at different times.",2022-08-18T09:00:17+0000
16,Data and video recorded by Tesla and other automakers to hone driver-assistance systems can also be an investigative tool for regulators and lawyers.,2022-08-18T21:09:54+0000
17,The company blamed its financial performance for the potential bonus cut.,2022-08-19T23:46:30+0000
18,The allegations by Twitter’s former security chief come after Elon Musk sued the company for more details on how it measures user numbers.,2022-08-23T12:41:58+0000
19,"The Federal Reserve chairman, Jay Powell, is expected to discuss inflation, interest rates and growth in his annual address from the economic symposium on Friday.",2022-08-26T12:12:51+0000
20,More than 100 subpoenas have been issued to techies like Jack Dorsey and Marc Andreessen as Twitter tries to force Elon Musk to complete a $44 billion deal. Law firms are stoked.,2022-08-29T09:00:36+0000
21,Twitter’s former security chief could loom large in Mr. Musk’s legal efforts to undo his $44 billion acquisition of the social network.,2022-08-29T11:46:27+0000
22,Peiter Zatko’s accusations of false statements and security shortcomings at Twitter may be used by Mr. Musk in the legal battle over a $44 billion acquisition of the company.,2022-08-29T15:06:08+0000
23,There's a dirty side to creating clean cars.,2022-08-30T09:00:02+0000
24,Hiding a thousand feet below the earth’s surface in this patch of northern Minnesota wetlands are ancient mineral deposits that some view as critical to fueling America’s clean energy future.,2022-08-30T09:00:28+0000
25,"The billionaire said in a letter to Twitter that allegations made by a whistle-blower have had a “material, if not existential” effect on the company.",2022-08-30T10:00:41+0000
26,"The bill, which would create a state council to establish minimum pay and safety conditions, was the subject of a giant lobbying battle.",2022-08-30T11:59:57+0000
0,"The country’s success with two- and three-wheeled vehicles that sell for as little as $1,000 could be a template for other developing countries.",2022-09-04T07:00:14+0000
1,"The billionaire can amend his lawsuit to include claims from a Twitter whistle-blower, but lost an effort to delay a trial over whether he could drop his bid to buy the company.",2022-09-07T12:12:51+0000
2,"Elon Musk’s lawyers had asked for a delay to review the accusations by a former Twitter executive, which the judge denied, while allowing the information to form part of their case.",2022-09-07T14:59:57+0000
3,"Lawyers for Elon Musk mentioned a $7 million payment to Peiter Zatko, Twitter’s former top security executive, in a court hearing this week.",2022-09-08T20:54:16+0000
4,"Elon Musk’s legal team will follow closely the testimony of Twitter’s former head of security, Peiter Zatko, before the Senate Judiciary Committee.",2022-09-13T12:01:02+0000
5,"At a Senate hearing, Peiter Zatko, Twitter’s former head of security, told lawmakers that the company lied about its data practices.",2022-09-13T15:07:29+0000
